{
  "coverage": {
    "issues": {
      "error": null,
      "pages": [
        {
          "number": 1,
          "records": 29,
          "sha256": "2e401625b2230062ef84312e229b88c903fe132e18130a3520ec6c7257b373d3"
        }
      ],
      "status": "complete"
    },
    "labels": {
      "error": null,
      "pages": [
        {
          "number": 1,
          "records": 41,
          "sha256": "98b710de9e8dfbf772285a88e70d4b0f4a499fde99220065d206a629381defa2"
        }
      ],
      "status": "complete"
    }
  },
  "diagnostics": [],
  "excluded_pull_requests": 1,
  "finished_at": "2026-10-06T17:25:42Z",
  "kind": "github-public",
  "mode": "observe",
  "mutation": "forbidden",
  "observed_at": "2026-10-06T17:25:23Z",
  "provenance": {
    "adapter_sha256": "fb39a92dab27330455a3573dfe6e2acedd7cc75ec9db42b07a184756f9193805",
    "lock_sha256": "ba4df41a0a19eb314ebfad4231efcb682d09adcca30307c32a1359b2cdf46ccd",
    "reviews_sha256": "9a88a4256085762fa89b8ba098a5cbb0f33b3eb0637d99be78619656fd239261",
    "runtime": {
      "egolint_sha256": "6907fd066ec448dd1e19658e617e5463a2fa85b83b2bae6b3b4500290b29bb39",
      "lock_sha256": "ba4df41a0a19eb314ebfad4231efcb682d09adcca30307c32a1359b2cdf46ccd"
    },
    "selection": {
      "contract": {
        "authority": "candidate",
        "contract_id": "egohygiene.issue-title/v1",
        "contract_version": "1.0.0",
        "repository": "egohygiene/.github",
        "revision": "19d2be9bf0191710508cefbb9f0b1abb3a40d9be",
        "source_digests": {
          ".github/issues/schema/title-contract.v1.schema.json": "9df220330ad07758122567620f557aa11aad85522914fe3f4cdc7de6a5ca7295",
          ".github/issues/title-contract.v1.json": "205202bda3c3b069a105924499ba7213a6a99645658e500cc910dfa085eeb30e",
          ".github/labels/catalog.v1.json": "7063a61608a66454310e5a7746b1514d1d11018da08427bfb49f4612326ff6ff",
          "docs/issue-titles.md": "243b5fdfec3fff82623fdcb43fa490829af9380d5f0b1d568f9f32b277de0660",
          "fixtures/issue-titles/cases.v1.json": "c21989c506e363c7b7845e0f63bdaf14f2e0de78f9d6c421d04e0f5a444edab2"
        }
      },
      "egolint": {
        "repository": "egohygiene/egolint",
        "revision": "20edc7d98ab7750388e4783ffaf1bab0d9278d60",
        "tree": "caeb2d3800d0d65de1822c59e74a9c671f0eab95"
      }
    },
    "shared_runtime_sha256": "b9e2cad75f0714a5d0cca4d64724020ba263af7899e2d4de740267f077254e22",
    "snapshot_sha256": "bb2198f37cc45437528a2e8aede017223e28669ded1ab9da5e4a68d98ea31dbc"
  },
  "repository": {
    "id": 1315637692,
    "name": "egohygiene/aether",
    "visibility": "public"
  },
  "rows": [
    {
      "current": {
        "complete": true,
        "labels": [],
        "schema_version": 1,
        "title": "Build the first-party AI artifact validation and publishing pipeline"
      },
      "id": 5188455751,
      "number": 38,
      "proposal": null,
      "reasons": [
        "REVIEWED_TYPE_AND_SUBJECT_REQUIRED"
      ],
      "review": null,
      "status": "needs-classification",
      "updated_at": "2026-08-19T03:01:00Z",
      "url": "https://github.com/egohygiene/aether/issues/38",
      "validation": {
        "message": "Select one known primary type label through review.",
        "report_sha256": "38b1f1da25ed1871d3f6e15cd1c9abc9aa1817565f6acbdb46e5c35f5d58fc0f",
        "status": "needs-classification",
        "type": null
      }
    },
    {
      "current": {
        "complete": true,
        "labels": [],
        "schema_version": 1,
        "title": "Add canonical prompt and instruction libraries"
      },
      "id": 5188458582,
      "number": 40,
      "proposal": null,
      "reasons": [
        "REVIEWED_TYPE_AND_SUBJECT_REQUIRED"
      ],
      "review": null,
      "status": "needs-classification",
      "updated_at": "2026-08-19T03:01:30Z",
      "url": "https://github.com/egohygiene/aether/issues/40",
      "validation": {
        "message": "Select one known primary type label through review.",
        "report_sha256": "38b1f1da25ed1871d3f6e15cd1c9abc9aa1817565f6acbdb46e5c35f5d58fc0f",
        "status": "needs-classification",
        "type": null
      }
    },
    {
      "current": {
        "complete": true,
        "labels": [],
        "schema_version": 1,
        "title": "Add an agent catalog and Copilot cost-control specification"
      },
      "id": 5188458687,
      "number": 41,
      "proposal": null,
      "reasons": [
        "REVIEWED_TYPE_AND_SUBJECT_REQUIRED"
      ],
      "review": null,
      "status": "needs-classification",
      "updated_at": "2026-08-19T03:01:31Z",
      "url": "https://github.com/egohygiene/aether/issues/41",
      "validation": {
        "message": "Select one known primary type label through review.",
        "report_sha256": "38b1f1da25ed1871d3f6e15cd1c9abc9aa1817565f6acbdb46e5c35f5d58fc0f",
        "status": "needs-classification",
        "type": null
      }
    },
    {
      "current": {
        "complete": true,
        "labels": [],
        "schema_version": 1,
        "title": "Publish the Mindgarden curator skill and ChatGPT handoff"
      },
      "id": 5273313024,
      "number": 51,
      "proposal": null,
      "reasons": [
        "REVIEWED_TYPE_AND_SUBJECT_REQUIRED"
      ],
      "review": null,
      "status": "needs-classification",
      "updated_at": "2026-09-18T18:48:53Z",
      "url": "https://github.com/egohygiene/aether/issues/51",
      "validation": {
        "message": "Select one known primary type label through review.",
        "report_sha256": "38b1f1da25ed1871d3f6e15cd1c9abc9aa1817565f6acbdb46e5c35f5d58fc0f",
        "status": "needs-classification",
        "type": null
      }
    },
    {
      "current": {
        "complete": true,
        "labels": [],
        "schema_version": 1,
        "title": "Add a people-first content authoring and review skill"
      },
      "id": 5285933827,
      "number": 56,
      "proposal": null,
      "reasons": [
        "REVIEWED_TYPE_AND_SUBJECT_REQUIRED"
      ],
      "review": null,
      "status": "needs-classification",
      "updated_at": "2026-08-29T10:13:55Z",
      "url": "https://github.com/egohygiene/aether/issues/56",
      "validation": {
        "message": "Select one known primary type label through review.",
        "report_sha256": "38b1f1da25ed1871d3f6e15cd1c9abc9aa1817565f6acbdb46e5c35f5d58fc0f",
        "status": "needs-classification",
        "type": null
      }
    },
    {
      "current": {
        "complete": true,
        "labels": [],
        "schema_version": 1,
        "title": "spec(distribution): extend release declarations with distribution targets, package coordinates, and publisher bindings"
      },
      "id": 5303662554,
      "number": 63,
      "proposal": {
        "format_validation": {
          "message": "Title matches the selected candidate definition; adoption is not assessed.",
          "report_sha256": "8a675e7fb823c9b6cb32e9f1da54398b5b2c9a32d643e9738bf6bc978c39f1a3",
          "status": "conformant",
          "type": "architecture"
        },
        "formatter_sha256": "12b9449f02c8ba21115d5c51eaa369a460b88e3f08183b0c0bd283799c6953a4",
        "provider_label": "missing",
        "required_label": "type:architecture",
        "snapshot": {
          "complete": true,
          "labels": [],
          "schema_version": 1,
          "title": "🏗️ [architecture] spec(distribution): extend release declarations with distribution targets, package coordinates, and publisher bindings"
        },
        "validation": {
          "message": "Select one known primary type label through review.",
          "report_sha256": "38b1f1da25ed1871d3f6e15cd1c9abc9aa1817565f6acbdb46e5c35f5d58fc0f",
          "status": "needs-classification",
          "type": null
        }
      },
      "reasons": [
        "PROVIDER_LABEL_MISSING",
        "CLASSIFICATION_REVIEW_REQUIRED"
      ],
      "review": {
        "id": 5303662554,
        "number": 63,
        "subject": "spec(distribution): extend release declarations with distribution targets, package coordinates, and publisher bindings",
        "type": "architecture"
      },
      "status": "blocked",
      "updated_at": "2026-09-28T21:25:40Z",
      "url": "https://github.com/egohygiene/aether/issues/63",
      "validation": {
        "message": "Select one known primary type label through review.",
        "report_sha256": "38b1f1da25ed1871d3f6e15cd1c9abc9aa1817565f6acbdb46e5c35f5d58fc0f",
        "status": "needs-classification",
        "type": null
      }
    },
    {
      "current": {
        "complete": true,
        "labels": [],
        "schema_version": 1,
        "title": "Define an evidence-backed agent capability manifest"
      },
      "id": 5320732435,
      "number": 64,
      "proposal": null,
      "reasons": [
        "REVIEWED_TYPE_AND_SUBJECT_REQUIRED"
      ],
      "review": null,
      "status": "needs-classification",
      "updated_at": "2026-09-02T06:47:28Z",
      "url": "https://github.com/egohygiene/aether/issues/64",
      "validation": {
        "message": "Select one known primary type label through review.",
        "report_sha256": "38b1f1da25ed1871d3f6e15cd1c9abc9aa1817565f6acbdb46e5c35f5d58fc0f",
        "status": "needs-classification",
        "type": null
      }
    },
    {
      "current": {
        "complete": true,
        "labels": [],
        "schema_version": 1,
        "title": "Define governed operational-agent workflows inspired by Teambridge"
      },
      "id": 5321929707,
      "number": 65,
      "proposal": null,
      "reasons": [
        "REVIEWED_TYPE_AND_SUBJECT_REQUIRED"
      ],
      "review": null,
      "status": "needs-classification",
      "updated_at": "2026-09-02T09:02:33Z",
      "url": "https://github.com/egohygiene/aether/issues/65",
      "validation": {
        "message": "Select one known primary type label through review.",